Company Name,Profile URL,Overall Rating,Total Reviews,Industry,Company Summary,Salary Rating,Job Security Rating,Work-Life Balance Rating,Scraped At
Digitide Solutions,https://www.ambitionbox.com/overview/conneqt-business-solutions-overview,3.5,10357,"IT Services & Consulting, BPO/KPO","Established in 2004, Conneqt Business Solutions Ltd. (formerly Tata Business Support Services Ltd) headquartered in Hyderabad, is a subsidiary of Quess Corp (BSE: 539978, NSE: QUESS), India’s leading business services provider. Throughout our journey, top industry analysts such as Gartner, Nelson Hall and Dun & Bradstreet have ranked us amongst the top Customer Lifecycle Management and Business Process Management service providers in India and the Middle East. We are committed to provide world-class customer experience with our dedicated team of over 32,000+ employees located across 26 delivery centres. We’re constantly refining our technologies and developing ideas to better serve our 120 clients in 24 Indian and 12 International languages in over 600 + locations across PAN India through our unique ‘Feet on Street’ offering. We have created a customer-centric collaborative ecosystem of people, platforms, processes and partners to align strategically with your business goals. We help elevate your organization with the power of our in-house domain expertise, cutting-edge technology, and analytics. Besides Customer Lifecycle Management and Business Process Management services, Conneqt also provides Finance and Accounting (FAO), HR Shared Services (HRSS) and Middle and Back Office Services. The company uses its innovative DiB (Digital-in a-Box) framework to help clients rapidly develop digital services that are market ready. Conneqt is also investing in automation and analytics capabilities and geographical expansion into US, Middle East and APAC.",3.0,3.4,3.4,2026-05-13 02:40:59
Mphasis,https://www.ambitionbox.com/overview/mphasis-overview,3.299999952316284,10255,"IT Services & Consulting, Financial Services, Hardware & Networking, Insurance, Emerging Technologies","Mphasis’ purpose is to be the “Driver in Driverless Car” for Global Enterprises by applying next-generation design, architecture and engineering services, to deliver scalable and sustainable software and technology solutions. Customer centricity is foundational to Mphasis and is reflected in the Mphasis’Front2BackTM Transformation approach. Front2BackTM uses the exponential power of cloud and cognitive to provide hyper-personalized (C=X2C2TM=1) digital experience to clients and their end customers. Mphasis’ Service Transformation approach helps ‘shrink the core’ through the application of digital technologies across legacy environments within an enterprise, enabling businesses to stay ahead in a changing world. Mphasis’ core reference architectures and tools, speed and innovation with domain expertise and specialization, combined with an integrated sustainability and purpose-led approach across its operations and solutions are key to building strong relationships with marquee clients.",2.7,3.4,3.5,2026-05-13 02:41:05
Yes Bank,https://www.ambitionbox.com/overview/yes-bank-overview,3.700000047683716,10200,"Banking, Banking / Insurance / Accounting, Financial Services","YES BANK, India’s fourth largest private sector bank is a high quality, customer centric and service driven Bank. Since inception in 2004, YES BANK has grown into a ‘Full Service Commercial Bank’ providing a complete range of products, services and technology driven digital offerings, catering to corporate, MSME & retail customers. YES BANK operates its Investment banking, Merchant banking & Brokerage businesses through YES SECURITIES and its Mutual Fund business through YES Asset Management (India) Limited, both wholly owned subsidiaries of the Bank. Headquartered in Mumbai, it has a pan-India presence across all 28 states and 9 Union Territories in India including an IBU at GIFT City, and a Representative Office in Abu Dhabi.",3.7,3.3,3.6,2026-05-13 02:41:09
Tata Steel,https://www.ambitionbox.com/overview/tata-steel-overview,4.0,9897,"Iron & Steel, Manufacturing, Metals & Mining, Power","We touch the lives of millions of people across the world every day with the steel that we produce. And it is highly likely that Tata Steel has affected your life today, though you may not know it. From the vehicle you drive, to the house you live in; from the bridges you cross, to the hand tools that you use, we strive to deliver unparalleled quality through our customised value-added solutions to make your life easier. This is made possible by our commitment to a culture of continuous improvement, through which we drive operational excellence in processes, products and people. Tata Steel, with an annual crude steel capacity of 34 million tonnes per annum (MnTPA), is one of the world’s most geographically diversified steel producers. We are one of the few steel operations that are fully integrated – from mining to the manufacturing and marketing of finished products. Continuous improvement in our product and service portfolio, along with success in value creating initiatives for customers, allows us to serve global growth markets. Today, we have our operations and commercial presence across the world. Tata Steel, together with its subsidiaries, associates, and joint ventures, is spread across five continents. Our Raw Material operations are spread across India and Canada which help us to be self-sufficient in steel production. Key manufacturing functions are performed by the raw materials and iron-making groups, while Shared Services provides maintenance support for a smooth production.",3.5,4.0,4.0,2026-05-13 02:41:14
Quess,https://www.ambitionbox.com/overview/quess-overview,3.799999952316284,9757,Recruitment,"Founded in 2007 and headquartered in Bengaluru, Quess has scaled from a start-up into one of the world’s largest and most trusted staffing organisations. Today, we operate across eight countries, engage over 480,000 professionals, and serve more than 2,200 clients worldwide across BFSI, Retail, Telecom, Manufacturing, Information Technology, Global Capability Centres (GCCs), and other critical industries.",3.5,3.4,3.7,2026-05-13 02:41:19
Asian Paints,https://www.ambitionbox.com/overview/asian-paints-overview,3.9000000953674316,9567,"Chemicals, Retail","Asian Paints: A Legacy of Innovation, Growth & Purpose Founded in 1942 by four visionary friends, Asian Paints began as a modest partnership firm with a bold ambition—to challenge the global giants in India’s paint industry. Over the decades, it has grown into India’s leading paint company and a global corporate force, driven by a relentless focus on consumers, innovation, and excellence. Who We Are We are passionate about colour, design, décor, and protection - making everything beautiful and enduring. As global innovators, we redefine trends with world-class, sustainable solutions that inspire people to realise their dreams. We co-create with customers and partners, transforming billions of spaces and lives. Our inclusive, dynamic workplace fosters creativity and drives positive change, bringing joy to the world! What We Do Asian Paints offers a comprehensive portfolio that includes: 1. Decorative & Industrial Paints 2. Waterproofing Solutions & Adhesives 3. Home Décor: Modular kitchens, wardrobes, bath fittings, sanitaryware, decorative lighting, uPVC windows & doors, wall coverings, furniture, fabrics, and rugs.",4.2,3.8,3.5,2026-05-13 02:41:23
Maruti Suzuki,https://www.ambitionbox.com/overview/maruti-suzuki-overview,4.099999904632568,9531,"Automobile, Manufacturing","Experiences fuelled by innovations, forward thinking, and a commitment to bring the very best to Indian roads. From the day the iconic Maruti 800 was launched in 1983, the company has been spearheading a revolution of change. Turning country’s necessity for driving, into its love for driving. However, tastes and demands keep on evolving with each new generation of Indians. This has not been looked at by Maruti Suzuki as a challenge, but as an inspiration to go beyond traditional boundaries of car-making. Infusing design and technology is one such step it has taken to make its cars meet new age expectations smoothly. Today, Maruti Suzuki has its eyes set firmly on the possibilities of tomorrow. And everybody is invited on this journey of growth through employment, of talented manpower who wants to contribute in this journey. Maruti Suzuki India Limited, BU Hansalpur is subsidiary of Suzuki Motor Corporation to produce automobiles in India, is running on 03 line production with capacity of 7.5 Lacs car manufacturing. This Plant Maruti Suzuki India Limited, BUH Gujarat plant was established in March 2014, aiming to secure production ability in preparation for the automobile market growth in India, as well as for expansion of exports from India. Plant A started operating in February 2017, and Plant B and Powertrain Plant in January 2019. In October 2020, Plant C started working. MSIL GJ became the fastest production site of Suzuki to achieve accumulated automobile production of 1 million units.",4.2,4.2,3.9,2026-05-13 02:41:28
Ericsson,https://www.ambitionbox.com/overview/ericsson-overview,3.9000000953674316,8414,"Telecom, Internet, Analytics & KPO","Creating game-changing technologies and services that shape our future - that's what we do. By combining creativity, expertise and technology, we open new possibilities in communication for you. And together, we support in resolving global challenges. For example by mitigating climate change and connecting every school in the world.",3.4,3.7,4.0,2026-05-13 02:41:31
Samsung,https://www.ambitionbox.com/overview/samsung-overview,3.9000000953674316,8332,"Consumer Electronics & Appliances, Consumer goods, Manufacturing, Electronics","Samsung Electronics is a global leader in technology, opening new possibilities for people everywhere. Through relentless innovation and discovery, we are transforming the worlds of TVs, smartphones, wearable devices, tablets, digital appliances, network systems, medical devices, semiconductors and LED solutions. Samsung is also leading in the Internet of Things space through, among others, our Smart Home and Digital Health initiatives. Since being established in 1969, Samsung Electronics has grown into one of the world’s leading technology companies, and become recognized as one of the top 10 global brands. Our network now extends across the world, and Samsung takes great pride in the creativity and diversity of its talented people, who drive our growth. To discover more, please visit our website at www.samsung.com and our official newsroom at news.samsung.com",3.8,3.6,3.7,2026-05-13 02:41:34
Dr. Reddy's,https://www.ambitionbox.com/overview/dr-dot-reddys-overview,4.0,8236,"Pharma, Clinical Research","We started in 1984 with a modest investment and a bold vision. Today, with research and development centres, manufacturing facilities and commercial presence across the globe, we serve over half a billion patients worldwide. We aspire to triple our reach and touch over 1.5 billion patients by 2030. We are committed to providing access to affordable and innovative medicines, driven by our purpose of ‘Good Health Can’t Wait’. Our products and services are spread across our core businesses of Active Pharmaceutical Ingredients (API), generics, branded generics, biosimilars and over-the-counter pharmaceutical products around the world. We work towards meeting unmet patients needs in the areas of gastro-enterology, cardiovascular, diabetology, oncology, pain management and dermatology. We are investing in businesses of the future including drug discovery, clinically-differentiated assets and digital healthcare.",3.9,3.5,3.9,2026-05-13 02:41:38
Optum Global Solutions,https://www.ambitionbox.com/overview/optum-global-solutions-overview,4.0,7973,"IT Services & Consulting, Hardware & Networking, Healthcare, Software Product","Optum, part of the UnitedHealth Group family of businesses, is a global organization that delivers care, aided by technology to help millions of people live healthier lives. The work you do with our team will directly improve health outcomes by connecting people with the care, pharmacy benefits, data and resources they need to feel their best. Here, you will find a culture guided by inclusion, talented peers, comprehensive benefits and career development opportunities. Come make an impact on the communities we serve as you help us advance health optimization on a global scale. Join us to start Caring. Connecting. Growing together.",3.5,4.2,4.1,2026-05-13 02:41:42
JSW Steel,https://www.ambitionbox.com/overview/jsw-steel-overview,3.9000000953674316,7901,"Iron & Steel, Financial Services, Metals & Mining, Engineering & Construction","JSW Steel has always been at the forefront of research and innovation. It has a strategic collaboration with global leader JFE Steel of Japan, enabling JSW to access new and state-of-the-art technologies to produce & offer high-value special steel products to its customers. These products are extensively used across industries and applications including construction, infrastructure, automobile, electrical applications, appliances, etc. JSW Steel is widely recognized for its excellence in business and sustainability practices. Some of these recognitions include World Steel Association’s Steel Sustainability Champion (consecutively 2019 to 2021), Leadership Rating (A-) in CDP (2020), Deming Prize for TQM for its facilities at Vijayanagar (2018) and Salem (2019). It is part of the Dow Jones Sustainability Index (DJSI) for Emerging Markets (2021) and S&P Global’s Sustainability Yearbook (consecutively for 2020 and 2021). JSW Steel is the only Indian company to be ranked among the top 15 global steel producers by World Steel Dynamics for 13 consecutive years since 2008. As a responsible corporate citizen, JSW Steel’s carbon reduction goals are aligned with India’s Climate Change commitments under the Paris Accord.",3.6,4.1,3.6,2026-05-13 02:41:47
JPMorgan Chase & Co.,https://www.ambitionbox.com/overview/jpmorgan-chase-and-co-dot-overview,3.799999952316284,7851,Financial Services,"JPMorgan Chase & Co. (NYSE: JPM) is a leading financial services firm with assets of $3.7 trillion and operations worldwide. The firm is a leader in investment banking, financial services for consumers and small businesses, commercial banking, financial transaction processing and asset management. Under the J.P. Morgan and Chase brands, the firm serves millions of customers, predominantly in the U.S., and many of the world’s most prominent corporate, institutional and government clients globally. We put our customers first, building with their needs in mind, providing worldclass service and growing to reach people, businesses and communities everywhere. We take pride in what we do and care deeply about our customers, communities and each other. We have a culture of teamwork, trust, humanity and humility. We create space for people to bring their full selves to work. We’re distinguished by our capacity to imagine and build. Our innovations are powered by a deep understanding of our customers and clients. We bring our capabilities and experience to bear on the toughest challenges in the world. We lead with expertise, foresight and fortitude to deliver exceptional results. We face facts and make disciplined decisions grounded in data, with a long-term view. We strive to stand up for what we believe in and do the right thing. Our quality and rigor at scale are unmatched. We attract world-class talent and create an environment where they can thrive. We set high expectations, commit to strong performance and hold ourselves accountable to the highest standards of integrity.",3.7,3.9,3.6,2026-05-13 02:41:52
Delhivery,https://www.ambitionbox.com/overview/delhivery-overview,3.799999952316284,7817,"Logistics, Internet, Logistics / Shipping, Urban Transport, Ports & Shipping","We are India’s largest fully integrated logistics provider. We aim to build the operating system for commerce, through a combination of world-class infrastructure, logistics operations of the highest quality and cutting-edge engineering and technology capabilities. Since its inception in 2011, our team has successfully fulfilled over 2 billion orders across India. We have built a nation-wide network with a presence in every state, servicing over 18,600 pin codes. 24 automated sort centres, 94 gateways, 2880 direct delivery centres, and a team of over 57,000 people make it possible for us to deliver 24 hours a day, 7 days a week, 365 days a year.",3.5,3.6,3.5,2026-05-13 02:41:58
ICICI Prudential Life Insurance,https://www.ambitionbox.com/overview/icici-prudential-life-insurance-overview,3.9000000953674316,7776,"Insurance, Financial Services","ICICI Prudential Life Insurance Company Limited (ICICI Prudential Life) is promoted by ICICI Bank Limited and Prudential Corporation Holdings Limited. ICICI Prudential Life began its operations in the fiscal year 2001. On a retail weighted received premium basis (RWRP), it has consistently been amongst the top companies in the Indian life insurance sector. Our Assets Under Management (AUM) on 31st March 2022 were `2,404.92 billion. At ICICI Prudential Life, we operate on the core philosophy of customer-centricity. We offer long-term savings and protection products to meet the different life stage requirements of our customers.",3.9,3.9,3.7,2026-05-13 02:42:01
Hexaware Technologies,https://www.ambitionbox.com/overview/hexaware-technologies-overview,3.4000000953674316,7694,"IT Services & Consulting, BPO/KPO","We're a community of 32,000+ Hexawarians dedicated to one singular purpose: creating smiles through great people and technology. With a presence in 54 offices across 28 countries, we enable enterprises worldwide to embark on their digital transformation journey with scale and speed. As an employer of choice for over three decades, we're more than just a workplace. We put people at the center of everything we do. Our diverse and inclusive work environment, paired with dynamic learning and development programs, empowers our teams to innovate, collaborate, and drive meaningful change. We’re driven by our shared vision of becoming the world’s most loved digital transformation partner—a trusted ally in shaping a brighter tomorrow. Visit www.hexaware.com to learn more about how we’re transforming lives and businesses globally.",3.0,3.3,3.4,2026-05-13 02:42:07
Ujjivan Small Finance Bank,https://www.ambitionbox.com/overview/ujjivan-small-finance-bank-overview,4.0,7634,"Banking, Financial Services","Ujjivan Small Finance Bank (USFB) Limited is among the leading small finance banks in the country. As a mass market bank, it remains committed to serve the unserved and underserved segments through financial and digital inclusion. We are now a one-stop destination for financial services and offer personalised customer experience to our wide customer base. With technology as a key enabler, Ujjivan Small Finance Bank continues to expand its reach and enhance customer experience. The strengthened digital interfaces, across regions and languages has empowered our customers to seek timely and easy access to finance; at all times. This has further enabled the Bank to deepen its customer connect across diverse locations. As a ‘Responsible Bank’ we stay invested in creating a sustainable social impact through community development and financial literacy initiatives. Ujjivan Financial Services Limited (UFSL) commenced operations as an NBFC in 2005, with the mission to provide a full range of financial services to the ‘economically active poor’ who were not adequately served by financial institutions. On receipt of License from RBI, UFSL set up Ujjivan Small Finance Bank (USFB) and USFB commenced its Banking operations from February 1, 2017. We are a ‘scheduled bank’ included in the Second Schedule to the Reserve Bank of India Act, 1934 and a listed Entity. Our IPO in 2019 was oversubscribed 170 times, and it was widely considered to be the best IPO in the last four years across the banking and financial services sector. The Bank has a Pan-India presence, with over 89 lakh customers, 752 banking touchpoints across 326 districts, 26 states and Union Territories, Our convenient alternative channels and digital footprint across internet banking, mobile application, tablet-based origination and phone banking among others, provide 24x7 access to full services of the Bank.",3.8,3.9,3.9,2026-05-13 02:42:10
Hindustan Unilever ,https://www.ambitionbox.com/overview/hindustan-unilever-overview,4.199999809265137,7193,"FMCG, Biotech & Life sciences, Healthcare / Pharma, Retail, Pharma","We’re driven by our purpose: to make sustainable living commonplace. With 90 years of heritage in India, Hindustan Unilever Limited (HUL) is India’s largest fast-moving consumer goods company. On any given day, nine out of ten Indian households use one or more of our brands, giving us a unique opportunity to build a brighter future. We are known for our great brands, the positive social impact we create and our belief in doing business the right way.",3.9,4.0,4.0,2026-05-13 02:42:14
ITC,https://www.ambitionbox.com/overview/itc-overview,3.9000000953674316,7181,"FMCG, Fashion & Textile, Hospitality, Pulp & Paper, Printing & Publishing","ITC is one of India's foremost private sector companies and a diversified conglomerate with businesses spanning Fast Moving Consumer Goods, Hotels, Paperboards and Packaging, Agri-Business, and Information Technology. The Company is acknowledged as one of India's most valuable business corporations with a Gross sales value of ₹ 76,097.31 crores and a Net Profit of ₹ 15,136.05 crores (as of 31.03.2020). ITC was ranked as India's most admired company, according to a survey conducted by Fortune India, in association with Hay Group. ITC is the country's leading FMCG marketer, the clear market leader in the Indian Paperboard and Packaging industry, a globally acknowledged pioneer in farmer empowerment through its wide-reaching Agri Business, a pre-eminent hotel chain in India that is a trailblazer in 'Responsible Luxury'. ITC's wholly-owned subsidiary, ITC Infotech, is a specialized global digital solutions provider. Over the last decade, ITC's new Consumer Goods Businesses have established a vibrant portfolio of 25 world-class Indian brands that create and retain value in India. ITC's world-class FMCG brands including Aashirvaad, Sunfeast, Yippee!, Bingo!, B Natural, ITC Master Chef, Fabelle, Sunbean, Fiama, Engage, Vivel, Savlon, Classmate, Papercraft, Mangaldeep, Aim, and others have garnered encouraging consumer franchise within a short span of time. While several of these brands are market leaders in their segments, others are making appreciable progress.",3.5,4.1,3.6,2026-05-13 02:42:19
Megha Engineering & Infrastructures,https://www.ambitionbox.com/overview/megha-engineering-and-infrastructure-overview,3.9000000953674316,6954,Engineering & Construction,"Megha Engineering & Infrastructures Ltd (MEIL) is a multi-sector infrastructure company with a strong footprint across various sectors like hydrocarbons, electric buses, defence, telecom, power, transport, manufacturing, general and social infrastructure, irrigation, and drinking water. This $5bn company is taking giant strides globally. Leveraging the advantage of its strength in having a diversified portfolio in multifarious sectors, the company has made its presence felt in areas that have been key drivers of growth.",3.7,3.7,3.8,2026-05-13 02:42:24
Coforge,https://www.ambitionbox.com/overview/coforge-overview,3.299999952316284,6915,"IT Services & Consulting, Consulting, Financial Services, Emerging Technologies, Software Product","Transform at the Intersect. Thrive with Coforge. Coforge is a global digital services and solutions provider that fuses deep domain expertise with emerging technology to deliver real-world business impact. With a sharp focus on select industries, a product engineering-led approach, and an execution intensity that’s uniquely our own, we’ve emerged as the 7 th largest Indian IT services firm and the Fastest of the ‘Fastest Five’ per HFS Research—with a revenue growth rate nearly 8x the industry average. In FY25, we recorded $1.45 billion in revenue, and we enter FY26 with a $1.5 billion executable order book—a testament to the trust we’ve earned and the outcomes we engineer. Our DNA is rooted in AI-driven engineering excellence, powered by an exceptional partner ecosystem and a strong commitment to innovation. We help businesses transform into intelligent, high-growth enterprises through capabilities in Generative AI, Cloud, Data & Analytics, Low-Code Platforms, Intelligent Automation, Cybersecurity, and more. We operate across 25 countries, with 30 global delivery centers, and a thriving global workforce of 33,497 employees. ""We are somewhat atypical in our approach to solving business problems. We are specialists, not just engineers and technologists, who spend an inordinate amount of time understanding the targeted functional spaces that we focus on."" — Sudhir Singh, CEO, Coforge A Culture of Belonging. A Place to Grow. At Coforge, we believe growth is mutual—we advance when our people thrive. We offer a non-discriminatory, inclusive, and empowering work environment where every individual is given the space and support to succeed. We’ve been certified as a Great Place to Work® four years in a row, and have been recognized for excellence in Employee Engagement, Learning & Development, and Corporate Social Responsibility.",3.1,3.2,3.4,2026-05-13 02:42:28
