Company Name,Profile URL,Overall Rating,Total Reviews,Industry,Company Summary,Salary Rating,Job Security Rating,Work-Life Balance Rating,Scraped At
Tata Projects,https://www.ambitionbox.com/overview/tata-projects-overview,4.199999809265137,6837,Engineering & Construction,"#StrongFoundationForStrongNation #BuildingNation #TransformingLives Tata Projects is one of the most admired Technology led Engineering, Procurement and Construction (EPC) companies in India. We have expertise in providing sustainable solutions in the execution of large and complex urban and industrial infrastructure projects while also demonstrating strong presence in refineries and petrochemical plants. We leverage our domain knowledge across various business segments to address the shift to clean energy to meet the nation’s Net Zero ambitions. We provide ready-to-deploy solutions for semiconductor facilities, giga factories, data centres, refineries, green fuels, roads, bridges, integrated rail & metro systems, commercial building & airports, power generation, transmission & distribution systems, chemical process plants, water & waste management, and mining & metal purification systems. Tata Projects offers one stop service covering entire life cycle of the project, from project conceptualization to operations & maintenance. It uses innovative technology solutions to offer bouquet of services which includes engineering, procurement, construction, commissioning, inspection & expediting, operations, repairs & maintenance, and shutdown services. Over the years, Tata Projects has received several awards and recognitions for its project delivery and commitment to safety & quality. We are a part of the TATA Group which operates in more than 100 countries across six continents, with a mission ‘To improve the quality of life of the communities we serve globally, through long-term stakeholder value creation based on Leadership with Trust’. In 2023-24, the revenue of Tata companies, taken together, was $165Billion. These companies collectively employ over 10,00,000 people.",4.2,4.0,4.0,2026-05-13 02:42:33
Bajaj Life Insurance,https://www.ambitionbox.com/overview/bajaj-life-overview,3.799999952316284,6645,"Insurance, Financial Services","Bajaj Life Insurance Limited, formerly known as Bajaj Allianz Life Insurance Company Limited, is one of India’s fastest-growing private life insurers. Our organisation has transitioned to being 100% owned by the Bajaj Group – a household name in India with a 100-year legacy of trust and credibility. As part of Bajaj Finserv Limited, one of the country’s most diversified and respected financial services groups, we bring innovation, a customer-first mindset, and technology-led solutions to the forefront. Today, we stand as a trusted partner to over 3.85 crore Indians in securing their future. At a glance, numbers you should know: ₹1,37,866 Cr Assets Under Management 343% Solvency Margin 99.29% Claim Settlement Ratio 597 Branches 1.64 Lakh+ Insurance Consultants (as on February, 2026) 28,000+ Bajaj Life Employees (as on February, 2026) We offer a diverse range of plans to support Life Goals at every stage. Our life insurance products ranging from ULIPs with Zero Allocation Charges to the SISO Investment Approach are built to drive long-term growth. Our holistic term plans address specific needs, whether it’s cover for diabetics, or the Superwoman Term Plan with enhanced critical illness benefits. Every product is thoughtfully designed to meet the Life Goals of millions of Indians. Driven by innovation and inclusivity, we remain committed in enabling customers achieve their Life Goals through value-driven, innovative products that are simple to understand, affordable and designed to address long-term needs such as protection, wealth creation, retirement planning, and more. These offerings are supported by a comprehensive suite of future driven, digital-first services across customer touchpoints, ensuring seamless accessibility and convenience. We have a robust distribution network of 597 branches and over 1,64,861 agents (as on February, 2026), complemented by partnerships with leading Indian banks as well as wide network of corporate agents, providing customers with convenient access to our products.",3.8,3.7,3.7,2026-05-13 02:42:37
Cholamandalam Investment & Finance,https://www.ambitionbox.com/overview/cholamandalam-investment-and-finance-overview,3.799999952316284,6634,Financial Services,"Cholamandalam Investment and Finance Company Limited (Chola), founded in 1978 as part of the Murugappa Group, initially focused on equipment financing. Over the years, Chola has transformed into a leading comprehensive financial services provider, offering a wide array of solutions including vehicle finance, home loans, SME loans, home equity loans, loan against property, consumer durable loans, and more. With a nationwide presence of 1,500+ branches and Assets Under Management (AUM) surpassing Rs. 1.77 lakh crore, Chola serves over 42.9 lakh happy customers. The company’s subsidiaries include Cholamandalam Securities Limited (CSEC), Cholamandalam Home Finance Limited (CHFL), and Payswiff Technologies Private Limited (Payswiff), enhancing its diverse portfolio. At Chola, our commitment is to foster growth and empowerment for customers, employees, shareholders, and communities alike. We are driven by a strong foundation of integrity, ethical values, and a deep sense of responsibility towards all our stakeholders. As we continue to grow and innovate, we aim to create sustainable value and contribute positively to the lives of those we serve, enabling them to enter a better life.",3.8,3.6,3.5,2026-05-13 02:42:41
L&T Technology Services,https://www.ambitionbox.com/overview/l-and-t-technology-services-overview,3.0999999046325684,6606,"IT Services & Consulting, Engineering & Construction","L&T Technology Services Limited (LTTS) is a global leader in Engineering and R&D (ER&D) services. With 470+ patents filed for 51 of the Global Top 100 ER&D spenders, LTTS lives and breathes engineering. Our innovations speak for itself – World’s 1st Autonomous Welding Robot, Solar ‘Connectivity’ Drone, and the Smartest Campus in the World, to name a few.",2.6,3.1,3.2,2026-05-13 02:42:46
FIS,https://www.ambitionbox.com/overview/fis-overview,3.799999952316284,6588,"FinTech, Software Product","FIS is a global leader in financial services technology, with a focus on retail and institutional banking, payments, asset and wealth management, risk and compliance, and outsourcing solutions. Through the depth and breadth of our solutions portfolio, global capabilities, and domain expertise, FIS serves more than 20,000 clients. Headquartered in Jacksonville, Florida. FIS employs more than 55,000 people worldwide and holds leadership positions in payment processing, financial software, and banking solutions. Providing software, services, and outsourcing of the technology that empowers the financial world, FIS is a Fortune 500 company and is a member of Standard & Poor’s 500® Index. For more information about FIS, visit www.fisglobal.com",3.5,3.4,4.0,2026-05-13 02:42:51
Oracle,https://www.ambitionbox.com/overview/oracle-overview,3.4000000953674316,6534,"Software Product, Financial Services, Internet, IT Services & Consulting","Oracle is the cloud leader for global business. Present in over 175 countries, we’re one of the biggest technology companies on the planet. With a fully integrated suite of cloud applications and infrastructure with global reach, we’re uniquely placed to transform businesses, empower governments, and energize nonprofits. Join us and you’ll drive meaningful change, work with innovative people, and shape the solutions that are making the world a better place. We put your potential in your hands with self-directed training, mentoring, and on-the-job learning. Share your aspirations and we’ll help you realize them. Culture and inclusion are part of everything we do. We thrive on the rich experiences and perspectives our people bring and so will you. We want you to ask questions, challenge how things are done, and innovate fearlessly. In return, you’ll get all the flexibility you need to bring your best self to your work. Explore careers today at oracle.com/in/careers",3.0,3.2,3.8,2026-05-13 02:42:56
